<?xml version="1.0" encoding="UTF-8" standalone="yes"?>
<hoster name="ImageVenue-Adult" version="0.3" xmlns:xsi="http://www.w3.org/2001/XMLSchema-instance" xsi:noNamespaceSchemaLocation="http://www.w3schools.com hoster.xsd">
	<displayName>ImageVenue (Adult)</displayName>
	<displayIcon>imagevenue.ico</displayIcon>
	<homePage>https://www.imagevenue.com</homePage>

	<maxFileSize>6000000</maxFileSize>
	<fileNameFilter>(?i)\.(?:jpg|jpeg)$</fileNameFilter>

	<maxConnections>5</maxConnections>

	<prepareUploadStep>
		<url>https://www.imagevenue.com/</url>
		<regex>
			<pattern>&lt;meta name=&quot;csrf-token&quot; content=&quot;(.+?)&quot;</pattern>
			<replacementVariable variableName="CSRFToken" replacement="$1" />
		</regex>
	</prepareUploadStep>

	<prepareUploadStep>
		<url>https://www.imagevenue.com/upload/session</url>
		<httpMethod>POST</httpMethod>
		<additionalField fieldName="thumbnail_size" fieldValue="2" />
		<additionalField fieldName="content_type" fieldValue="nsfw" />
		<additionalField fieldName="comments_enabled" fieldValue="false" />
		<additionalHeader headerName="X-CSRF-TOKEN" headerValue="${CSRFToken}" />
		<regex>
			<pattern>&quot;data&quot;:&quot;(.+?)&quot;</pattern>
			<replacementVariable variableName="UploadData" replacement="$1" />
		</regex>
		<regex>
			<pattern>&quot;session&quot;:&quot;(.+?)&quot;</pattern>
			<replacementVariable variableName="UploadSessionID" replacement="$1" />
		</regex>
	</prepareUploadStep>

	<uploadStep>
		<url>https://www.imagevenue.com/upload</url>
		<fieldName>files[0]</fieldName>
		<additionalField fieldName="data" fieldValue="${UploadData}" />
		<additionalField fieldName="_token" fieldValue="${CSRFToken}" />
		<failureRegex>
			<pattern>There was an error uploading the files</pattern>
		</failureRegex>
	</uploadStep>
	
	<prepareResultStep>
		<url>https://www.imagevenue.com/upload/complete?session=${UploadSessionID}</url>
	</prepareResultStep>
	
	<uploadResultStep>
		<regex>
			<pattern>(?ism)(\[URL=[^\]]+\]\[IMG\][^\[]+\[/IMG\]\[/URL\])</pattern>
			<replacement>$1</replacement>
		</regex>
	</uploadResultStep>
</hoster>
